{
    "$schema": "../core-vault-manager-parameters.schema.json",
    "assetManager": "AssetManager_FTestXRP",
    "underlyingAddress": "rDhpmiPq4BVBDWMVdSrmkgt8thKyRzGV1p",
    "initialSequenceNumber": 10167328,
    "custodianAddress": "r3GhxcaM4f9BJXEu1JLRgDXZpHJw6ugkH4",
    "escrowAmount": "10000 000000",
    "escrowEndTimeSeconds": 46800,
    "minimalAmountLeft": "15000 000000",
    "chainPaymentFee": "400"
}
